Project No,RERA Regd. No,Project Name,Promoter Name,Promoter Address,GST No
1,RP/01/2025/01362,Basanti Enclave,M/S. NEELACHAL INFRA DEVELOPERS PVT. LTD,"Gurudwara, PO-South Balanda, Via: Talcher Rural INR, Angul-759116, Dist. Angul, Odisha ,,,,,",21AADCN5439J2ZH
2,RP/19/2025/01361,UDYAYEEN,SHYAMCHAND BUILDERS PRIVATE LIMITED,"MIG-II 21/2 Ground Floor,Chandrasekharpur,Bhubaneswar,Khordha,Odisha,751016",N/A
3,PS/28/2025/01360,BARSANA RESIDENCY - II,RITA PODDAR,"PLOT NO-2570,PODDAR HEIGHTS,PODDAR COLONY,KHETRAJPUR,Sambalpur,Odisha,768003",N/A
4,PS/7/2025/01358,KRISHNA MANOR PH-II,KRISHNA PROPERTIES & DEVELOPERS PRIVATE LIMITED,"Plot No-46, Indraprastha Housing Colony, Phase-II, Pokhariput, Bhubaneswar, Khordha, Odisha-751020.,,,,,",21AAECK8663L2Z7
5,PS/19/2025/01351,BHAVYAVILLA,SUNSHINE INFRATECH,"PLOT NO 339,GOUTAMNAGAR,BJB NAGAR,Khordha,Odisha,751014",N/A
